"Authors","Author full names","Author(s) ID","Title","DOI","Link","Abstract"
"Sørensen C.R.; Brendorp B.; Rask-Madsen C.; Køber L.; Kjøller E.; Torp-Pedersen C.","Sørensen, C.R. (57213958233); Brendorp, B. (6701551069); Rask-Madsen, C. (6602821461); Køber, L. (57209093328); Kjøller, E. (7004096811); Torp-Pedersen, Christian (57210100954)","57213958233; 6701551069; 6602821461; 57209093328; 7004096811; 57210100954","The prognostic importance of creatinine clearance after acute myocardial infarction","10.1053/euhj.2001.2989","https://www.scopus.com/inward/record.uri?eid=2-s2.0-0036623942&doi=10.1053%2feuhj.2001.2989&partnerID=40&md5=87de94c2009d6877390835ecc0743a05","Aims: The purpose of this study was to assess renal dysfunction as an independent predictor of mortality after acute myocardial infarction. Methods: The study population was 6252 patients with a myocardial infarction admitted alive from 1990 to 1992. The mortality status was obtained after at least 6 years. Results: Cox proportional-hazards model demonstrated that the unadjusted risk ratio associated with a calculated creatinine clearance ≤40 ml . min-1 compared to a clearance above 85 ml . min-1 was 7·1(95% confidence interval 6·2-8·0). Adjustment for multiple available covariates reduced this risk to 2·0(1·6-2·4). The unadjusted risk ratio associated with clearance from 41 to 55 ml . min-1 and from 71 to 85 ml . min-1 was 3·7(3·3-4·2) and 1·5 (1·3-1·7) respectively, but after adjustment for all available variables these risks were reduced to 1·4(1·2-1·6) and 1·1(0·9-1·3) respectively. Conclusion: Renal dysfunction is an important risk factor after acute myocardial infarction. When the risk is adjusted for available competing risk factors only severely reduced renal function is associated with an important and independent risk of mortality after acute myocardial infarction. The risk of a moderate reduction in renal function is almost fully explained by an association with other conditions. © 2002 The European Society of Cardiology. Published by Elsevier Science Ltd. All rights reserved."
"Matsuo T.; Richmond A.D.; Nychka D.W.","Matsuo, Tomoko (7403702957); Richmond, Arthur D. (7103083539); Nychka, Douglas W. (6604045869)","7403702957; 7103083539; 6604045869","Modes of high-latitude electric field variability derived from DE-2 measurements: Empirical orthogonal function (EOF) analysis","10.1029/2001GL014077","https://www.scopus.com/inward/record.uri?eid=2-s2.0-0036555086&doi=10.1029%2f2001GL014077&partnerID=40&md5=8325687951f901cd2719ae4978ee1fec","In this study we characterize dominant modes of high-latitude electric field variability as a set of two-dimensional empirical orthogonal functions (EOFs), based on a sequential non-linear regression analysis of the electric field derived from plasma drift measurements during the Dynamics Explorer-2 (DE-2) satellite mission (1981-1983). Together with the mean fields, 11 EOFs are capable of representing 68% of the squared electric field in the original data, leaving only a fairly random component as a residual. While such mathematically independent EOFs do not necessarily represent physically independent modes of variability, each of the first two EOFs is actually related to a widely known physically prominent effect on the convection patterns. Variability associated with the interplanetary magnetic field (IMF) BY component emerges as the primary mode, and variability associated with the IMF BZ effect emerges as the secondary mode. The tertiary mode reflects variability in the cusp region, but is not significantly correlated with the IMF."
"Siani A.; Cappuccio F.P.; Barba G.; Trevisan M.; Farinaro E.; Iacone R.; Russo O.; Russo P.; Mancini M.; Strazzullo P.","Siani, Alfonso (7004396206); Cappuccio, Francesco P. (7006704793); Barba, Gianvincenzo (7006227649); Trevisan, Maurizio (57205343912); Farinaro, Eduardo (7005521440); Iacone, Roberto (6603820896); Russo, Ornella (57818071500); Russo, Paola (7202451202); Mancini, Mario (57217489605); Strazzullo, Pasquale (7005192838)","7004396206; 7006704793; 7006227649; 57205343912; 7005521440; 6603820896; 57818071500; 7202451202; 57217489605; 7005192838","The relationship of waist circumference to blood pressure: The Olivetti Heart Study","10.1016/S0895-7061(02)02976-X","https://www.scopus.com/inward/record.uri?eid=2-s2.0-0036724871&doi=10.1016%2fS0895-7061%2802%2902976-X&partnerID=40&md5=c651364f509ecc7ed4dd43bd4f8b05b1","Background: The association between overweight, high blood pressure (BP), and insulin resistance is well established, but the role of body fat distribution in this association has yet to be fully elucidated. The aim of this study was to investigate the role of central adiposity in the association between overweight, high BP, and insulin resistance. Methods: A total of 1079 men participated in the follow-up of the Olivetti Heart Study from 1994 to 1995. The present analysis includes 768 men, after the exclusion of 184 participants on pharmacological treatment for hypertension. In 65 men fasting blood glucose was >7 mmol/L; in 48, age was below or above 2 standard deviations from the mean of the population; and in 14 the data set was incomplete. Anthropometric indices of adiposity, metabolic variables (including fasting serum insulin and homeostasis model assessment [HOMA] index of insulin sensitivity), and BP were measured. Results: In univariate analysis, waist circumference was the anthropometric index that best correlated with BP (P < .001). In multiple regression analysis, waist circumference remained the strongest independent predictor of BP after adjustment for confounders. Significant increase of systolic (P value for trend analysis < .001) and diastolic (P < .001) pressure, heart rate (P = .003), fasting and postload serum insulin (P < .001), and HOMA index of insulin sensitivity (P < .001) were observed across age-adjusted quintiles of waist circumference. Greater degrees of central adiposity were associated with higher prevalence of elevated BP values and insulin resistance (P value < .001, X2 for linear trend). Conclusions: In middle-aged men, a central distribution of body fat is associated with increased BP, independently of body mass index and insulin resistance, thus suggesting a key role of central adiposity in the full expression of the ""metabolic syndrome."" © 2002 American Journal of Hypertension, Ltd."
"Lim C.W.; Fujiwara S.-I.; Yamashita F.; Hashida M.","Lim, Chee Wooi (37041904700); Fujiwara, Shin-Ichi (24604873400); Yamashita, Fumiyoshi (7102210595); Hashida, Mitsuru (26643164100)","37041904700; 24604873400; 7102210595; 26643164100","Prediction of human skin permeability using a combination of molecular orbital calculations and artificial neural network","10.1248/bpb.25.361","https://www.scopus.com/inward/record.uri?eid=2-s2.0-0036513217&doi=10.1248%2fbpb.25.361&partnerID=40&md5=e96dfb7ef34da005dc28ebe50cca0340","This study was carried out to develop a novel method for predicting the skin permeability coefficient (log Kp) of compounds from their three-dimensional molecular structure using a combination of molecular orbital (MO) calculation and artificial neural network. Human skin permeability data on 92 structurally diverse compounds were analyzed. The molecular descriptors of each compound, such as the dipole moment, polarizability, sum of charges of nitrogen and oxygen atoms (sum(N,O)), and sum of charges of hydrogen atoms bonding to nitrogen or oxygen atoms (sum(H)) were obtained from MO calculations. The correlation between these molecular descriptors and log Kp was examined using feed-forward back-propagation neural networks. To improve the generalization capability of a neural network, the network was trained with input patterns given 5% random noise. The neural network model with a configuration of 4-4-1 for input, hidden, and output layers was much superior to the conventional multiple linear regression model in terms of root mean square (RMS) errors (0.528 vs. 0.930). A ""leave-one-out"" cross-validation revealed that the neural network model could predict skin permeability with a reasonable accuracy (predictive RMS error of 0.669)."
"Lara-Castro C.; Weinsier R.L.; Hunter G.R.; Desmond R.","Lara-Castro, Cristina (6602644476); Weinsier, Roland L. (7006368721); Hunter, Gary R. (7202435402); Desmond, Renée (7003434675)","6602644476; 7006368721; 7202435402; 7003434675","Visceral adipose tissue in women: Longitudinal study of the effects of fat gain, time, and race","10.1038/oby.2002.119","https://www.scopus.com/inward/record.uri?eid=2-s2.0-0036731298&doi=10.1038%2foby.2002.119&partnerID=40&md5=79afaeb1f0a6f9b3119b6d6cfa3385c8","Objective: To determine the effects of fat gain, time, and race on the accumulation of visceral adipose tissue (VAT) in a group of normal-weight premenopausal women. Research Methods and Procedures: Sixty-five women participated in the study (32 African American and 33 white). The mean age of subjects was 34 ± 6 years (range, 22 to 47 years). Eligible subjects were women who had body mass indices <25 kg/m2 at baseline and who had completed evaluations at baseline and at follow-up year 1, without intervention. A subset of subjects was reevaluated annually for up to 4 years. Body composition was assessed by DXA, and VAT was determined from a single computed tomography scan. A linear mixed model was used to examine changes in VAT over time, with total body fat as a covariate Results: Total fat mass was not significantly different between races at baseline and increased significantly in both groups over time (p < 0.001). Time-related increases in total body fat were greater in African-American women (p < 0.01). VAT was significantly higher in white women at baseline (p < 0.01) and increased significantly over time in both races (p < 0.01), but remained higher in white women (p < 0.001 ). Increases in VAT, relative to total body fat, were greater than the increases in total body fat over time, independent of age and race (p < 0.001). Discussion: Gaining total body-fat mass results in a higher increase in VAT, relative to total body fat, regardless of race and age, although African-American women maintain a lower VAT levels across time."
"Lee H.-M.; Huang Y.-Z.; Chen J.-J.J.; Hwang I.-S.","Lee, H.-M. (7501487724); Huang, Y.-Z. (7501574789); Chen, Jia-Jin J. (7501903550); Hwang, I.-S. (13307260500)","7501487724; 7501574789; 7501903550; 13307260500","Quantitative analysis of the velocity related pathophysiology of spasticity and rigidity in the elbow flexors","10.1136/jnnp.72.5.621","https://www.scopus.com/inward/record.uri?eid=2-s2.0-0036240892&doi=10.1136%2fjnnp.72.5.621&partnerID=40&md5=62bfd594ec79fc49f21453834168469a","Objective: To quantify velocity dependent and position related properties of increased muscle tone measured during a constant velocity stretch. Methods: Elbow flexors were vertically stretched under four different velocities (40, 80, 120, and 160°/s) through a 75° range of motion in 12 patients with hemiparesis, 16 with parkinsonism, and 12 normal controls. From reactive torque measurement, a linear second order model was adopted to dissociate velocity dependent viscous and velocity independent elastic components. The averaged speed dependent reflex torque (ASRT) - defined as the deviation of measured torque from baseline torque - was used to quantify the viscous component of hypertonia. Velocity sensitivity of ASRT (VASRT) and segmented ASRT (SASRT), derived from the slope of the regression line among ASRT velocity plots and from segmentations of reactive torque, respectively, were used to differentiate the increased muscle tone of spasticity and rigidity. Results: ASRT and VASRT were significantly higher in both spasticity and rigidity than in normal controls. SASRT analysis showed three different position related patterns among spasticity, rigidity, and normal groups: spasticity showed progressively increasing muscle tension relative to position; rigidity showed increased (relative to the norm) but constant muscle tone over the entire stretch range; the normal control group showed a consistently low reactive torque over the entire range. Conclusions: Velocity dependence analysis indicates that rigidity and spasticity have approximately equal velocity dependent properties. For differentiating these two types of hypertonia, position dependent properties my be employed."
"Coffey M.P.; Simm G.; Brotherstone S.","Coffey, M.P. (7102419845); Simm, G. (7004736143); Brotherstone, S. (7003619125)","7102419845; 7004736143; 7003619125","Energy balance profiles for the first three lactations of dairy cows estimated using random regression","10.3168/jds.S0022-0302(02)74352-X","https://www.scopus.com/inward/record.uri?eid=2-s2.0-0036783211&doi=10.3168%2fjds.S0022-0302%2802%2974352-X&partnerID=40&md5=0464422de6ca098d542c0d75625aee0b","Daily animal solutions were predicted using random regression analysis for feed intake, milk yield, live weight, and condition score recorded on 189 cows at the Langhill Dairy Cattle Research Centre. All cows had three successive lactations. Energy balance for days 1 to 305 of each of the three lactations was calculated both from daily measures of feed intake and milk output and from weekly measures of live weight and condition score. Cows returned to positive energy balance at days 72, 75, and 95 in lactations 1, 2, and 3, respectively, based on energy balance calculated from feed intake and milk output records (EB1), and at days 77, 83, and 73 based on energy balance calculated from body energy state changes (EB2). Correlations between energy balance at the same time in successive lactations ranged from 0.01 to 0.66 depending on the method of calculation and the stage of lactation. Energy balance over three lactations was modelled using sinusoidal functions which were associated with individual cows and allowed to vary between cows. The parameters of these curves are potentially useful since they have a biological interpretation. The phase relates to the period from calving to return to positive energy balance, and the amplitude relates to the degree of body energy loss (and recovery). The sinusoidal functions fitted to the curve removed a significant proportion of the variation, but accounted for only 45% and 40% of the variation in EB1 and EB2, respectively. The relationship between energy balance in the first three lactations is likely to be more complex than a simple linear function, but the profile of energy balance over the first three lactations may be a useful selection criteria in a multi-trait index. Energy balance profile over lactations one to three can be modelled with moderate accuracy using sinusoidal functions, and this warrants further research."
"Franck L.S.; Treadwell M.; Jacob E.; Vichinsky E.","Franck, Linda S (7005919617); Treadwell, Marsha (7004923571); Jacob, Eufemia (7102363305); Vichinsky, Elliott (57203056851)","7005919617; 7004923571; 7102363305; 57203056851","Assessment of sickle cell pain in children and young adults using the adolescent pediatric pain tool","10.1016/S0885-3924(01)00407-9","https://www.scopus.com/inward/record.uri?eid=2-s2.0-0036181907&doi=10.1016%2fS0885-3924%2801%2900407-9&partnerID=40&md5=52e9af4b60bc21483c0fcc0239eb1855","The objectives of this study were to describe and compare the characteristics of pain experienced by children and young adults with sickle cell disease (SCD) in inpatient and outpatient settings. The Adolescent Pediatric Pain Tool (APPT), a multidimensional self-report pain assessment, was completed by African American children and young adults (mean age 15.39 ± 4.32) with SCD during a clinic visit (n = 52), day hospital visit (n = 29), or during the first 24 hours of an inpatient stay (n = 72). Multiple linear regression revealed that pain intensity, number of body areas with pain, and the quality of pain were related to age, sex, and care setting. Pain intensity, location, and quality were of greater magnitude than previous reports of early postoperative pain in children. Examining the specific dimensions of pain intensity, location, and quality and the influencing factors of age, sex, and care setting may lead to more effective treatments for SCD pain. © U.S. Cancer Pain Relief Committee, 2002."
"Page A.; Morrell S.; Taylor R.","Page, A. (7201642335); Morrell, S. (55579182800); Taylor, R. (57188969324)","7201642335; 55579182800; 57188969324","Suicide and political regime in New South Wales and Australia during the 20th century","10.1136/jech.56.10.766","https://www.scopus.com/inward/record.uri?eid=2-s2.0-0036786285&doi=10.1136%2fjech.56.10.766&partnerID=40&md5=22db95ff81f116232da47d671e6074f4","Study objective: Australia has had a two party parliamentary political system for most of the period since its Federation in 1901, dominated either by a social democratic (Labor) or a conservative ideological perspective. This paper investigates whether such political differences at Federal and State levels have influenced suicide rates in the state of New South Wales (NSW) for the period 1901-1998. Design: Federal government type, NSW State government type, and combinations of both Federal and NSW State government type were examined. Poisson regression models were stratified by sex and controlled for the effects of age, annual change in gross domestic product, sedative availability, drought, and both world wars. Results: When both Federal and NSW State governments were conservative the relative risk of suicide for NSW men was 1.17 (p<0.001) and for women 1.40 (p<0.001) compared with both governments being Labor (1.00). A statistically significant linear trend (p<0.001) in suicide risk was evident across the continuum of Federal/State government combinations, from both Labor (lowest), to mixed (intermediate), to both conservative (highest). Conclusion: Significantly higher suicide risk was associated with conservative government tenures compared with social democratic incumbents. Results are discussed in terms of the differences underpinning conservative and social democratic government programme ideology, and their relevance to Durkheim's theories of suicide, social regulation, and integration."
"Aslam S.; Friedman E.A.; Ifudu O.","Aslam, Shakil (58380815300); Friedman, Eli A. (7403013537); Ifudu, Onyekachi (7005867535)","58380815300; 7403013537; 7005867535","Electrocardiography is unreliable in detecting potentially lethal hyperkalaemia in haemodialysis patients","10.1093/ndt/17.9.1639","https://www.scopus.com/inward/record.uri?eid=2-s2.0-0036712883&doi=10.1093%2fndt%2f17.9.1639&partnerID=40&md5=34fac0b8952dcc95fdf2ecaceab77ac0","Background. It is speculated, but unconfirmed, that the usual electrocardiographic manifestations of hyperkalaemia are less frequent and less pronounced in persons with end-stage renal disease (ESRD) than in those with normal renal function. We studied 74 consecutively selected stable haemodialysis patients to determine the prevalence of electrocardiographic changes of hyperkalaemia in stable persons with ESRD receiving haemodialysis. Methods. Pre-dialysis serum potassium concentration and other electrolytes were measured and simultaneous 12-lead electrocardiogram obtained. Results. The 74 study subjects (45 men, 29 women) comprised 63 blacks (85%), four Hispanics (6%), four whites (6%), and three Asians (4%) of mean ± standard deviation age 55.5 ± 14.7 years. Mean pre-dialysis potassium concentration was 4.9 ± 0.71 mEq/1 (range 3.3-6.7). No study subject evinced arrhythmia or any of the typical electrocardiographic changes associated with hyperkalaemia. There was no significant difference in T wave amplitude (F statistic = 2.1; P = 0.11) or T wave to R wave ratio (F statistic = 2; P = 0.12) between quartiles of serum potassium concentration. Also, T wave amplitude was equivalent in patients with serum potassium concentration > 5.5 mEq/1 (7.1 ± 4.1 mm) or ≤ 5.5 mEq/1 (5.2 ± 3.5 mm) (P = 0.13). Linear regression analysis showed that the total serum calcium concentration had an inverse relation with T wave amplitude (P = 0.03) after adjustment for other factors (a high total serum calcium concentration was associated with a low T wave amplitude). Conclusion. Haemodialysis patients with hyperkalaemia may not exhibit the usual electrocardiographic sequella of hyperkalaemia, possibly due in part to fluctuations in serum calcium concentration. Thus, the absence of electrocardiographic changes in hyperkalaemic haemodialysis patients should be inter reted with caution."
"Bottai M.; Pistelli F.; Di Pede F.; Carrozzi L.; Baldacci S.; Matteelli G.; Scognamiglio A.; Viegi G.","Bottai, M. (12544844900); Pistelli, F. (6603740943); Di Pede, F. (7005657664); Carrozzi, L. (7003822310); Baldacci, S. (7003668400); Matteelli, G. (6506823145); Scognamiglio, A. (6604002971); Viegi, G. (7007103216)","12544844900; 6603740943; 7005657664; 7003822310; 7003668400; 6506823145; 6604002971; 7007103216","Longitudinal changes of body mass index, spirometry and diffusion in a general population","10.1183/09031936.02.01282001","https://www.scopus.com/inward/record.uri?eid=2-s2.0-0036738138&doi=10.1183%2f09031936.02.01282001&partnerID=40&md5=92c2e9df3498bb13131a51aeee6ecee2","The aim of this study was to evaluate the effects of body mass index (BMI) changes over an 8-yr follow-up, on longitudinal changes of vital capacity (VC), forced vital capacity (FVC), forced expiratory volume in one second (FEV1), and carbon monoxide diffusing capacity of the lung (DL,CO) indices in a general population sample of North Italy. To avoid including weight changes possibly related to physical growth, only the 1,426 adults (>24 yrs, 46% males) with complete follow-up were selected. Median linear regression models were applied to estimate the medians of change (computed as follow-up minus baseline values) of VC, FVC, FEV1 and DL,CO indices, as functions of changes of BMI over the follow-up period, separately by sex, after considering several potential confounders and effect modifiers. The extent of lung function loss tended to be higher among those who, at baseline, reported greater BMI values. Males experienced larger losses than females (20 and 16 mL FEV1 median reduction for a BMI unit increase in males and females, respectively). Conversely, longitudinal changes of BMI caused a slight and nonsignificant increase in DL,CO values in both sexes. Over an 8-yr follow-up, the detrimental effect of gaining weight might be reversible for many adults as most of those who reduced their body mass index values also increased their lung function. Overweight patients with ventilatory impairment should be routinely encouraged to lose weight for improving their lung function."
"Gutzwiller J.-P.; Schneditz D.; Huber A.R.; Schindler C.; Gutzwiller F.; Zehnder C.E.","Gutzwiller, Jean-Pierre (6604004297); Schneditz, Daniel (7006437158); Huber, Andreas R. (55626379100); Schindler, Christian (58501456300); Gutzwiller, Felix (7102528600); Zehnder, Carlos E. (7004373560)","6604004297; 7006437158; 55626379100; 58501456300; 7102528600; 7004373560","Estimating phosphate removal in haemodialysis: An additional tool to quantify dialysis dose","10.1093/ndt/17.6.1037","https://www.scopus.com/inward/record.uri?eid=2-s2.0-0035991965&doi=10.1093%2fndt%2f17.6.1037&partnerID=40&md5=bc26fddbfff0033cb17602af7f7b58cb","Background. Half of the dialysis population suffers from hyperphosphataemia, which is now recognized as a major factor of haemodialysis (HD) morbidity and mortality. Current control is focussed on reducing dietary phosphate intake and diminishing absorption using phosphate binders, whereas control and quantification of phosphate removal by HD is undervalued. The aim of this prospective study was to develop a simple, bedside formula to estimate dialytic phosphate removal in stable HD patients. Methods. This was a prospective, randomized trial. Phosphate and urea elimination were assessed in a representative group of patients at two dialysis centres using randomly different dialysers (1.3-2.4 m2). Quantification was performed by partial dialysate collection, concentration measurements in blood and effluent dialysate spot samples, and Kt/Vurea during standard high-flux HD. Multiple linear regression analyses were used in 77% of all data sets to generate an equation to predict phosphate removal. The formula was validated in the remaining 23% of data sets, in the same group of patients using a large capillary filter, and in diabetic patients treated with a small dialyser at different blood flows (200, 250, and 300 ml/min). Results. A formula allowing quantification of phosphate removal within one HD session was developed in 18 of 74 patients during 41 treatments (137 out of 177 data sets) and was determined as: MPO4pred = 0.1t - 17 + 50cds60 + 11cb60, where t is treatment time in min, cds60 and cb60 are phosphate concentrations in dialysate and plasma measured 60 min into HD in mmol/l, and MPO4pred is estimated phosphate removed in mmol. The precision was remarkable (r2 = 0.92-0.94). The comparison of phosphate and Kt/Vurea showed a significant association (r2=0.28), albeit with remarkable scatter. Conclusions. We present the first approach to quantify phosphate removal during high-flux HD by a bedside formula. Only 28% of the variation in phosphate removal was explained by Kt/Vurea. It appears that other factors not adequately accounted for by Kt/Vurea affect phosphate removal. Therefore, we propose an individual control and quantification of phosphate removal in HD."
