"Authors","Author full names","Author(s) ID","Title","DOI","Link","Abstract"
"Liu Y.C.; Blair E.M.","Liu, Yingxin C. (8934978500); Blair, Eve M. (7102527186)","8934978500; 7102527186","Predicted birthweight for singletons and twins","10.1375/136905202762341991","https://www.scopus.com/inward/record.uri?eid=2-s2.0-0036912665&doi=10.1375%2f136905202762341991&partnerID=40&md5=6c0bb156b92f11dd00c8cae71abded8f","This population-based study determined the impact of co-twin gender on twin intrauterine growth in addition to their infant gender, maternal height, maternal age and parity on intrauterine growth rate of singletons and twins. All singletons and twins born in Western Australia during the period of 1980 to 1995 were considered for the study. The multiple linear regression models showed that 76% of the variance in the mean birthweight was explained by the selected variables for twins and 51% for singletons. Twins grew more slowly than singletons from 26 weeks gestation. Among twins, opposite-sex twin pairs grew consistently faster than like-sex twins. Primiparous twin pairs grew more slowly than subsequently born twins. These regression equations can be used to assess the appropriateness of intrauterine growth in twin pairs of various gender combinations."
"Brabin L.; Verhoeff F.; Brabin B.J.","Brabin, L. (7004536340); Verhoeff, F. (6701545144); Brabin, B.J. (7006297382)","7004536340; 6701545144; 7006297382","Maternal height, birthweight and cephalo pelvic disproportion in urban Nigeria and rural Malawi","10.1034/j.1600-0412.2002.810605.x","https://www.scopus.com/inward/record.uri?eid=2-s2.0-0036280034&doi=10.1034%2fj.1600-0412.2002.810605.x&partnerID=40&md5=9bc35ea315455bfaab72cd062cc3383a","Background. Cephalo pelvic disproportion (CPD) has been attributed to short stature. It has been suggested that nutritional supplementation to promote linear growth would increase birthweight and the risk of CPD. The objective of this study was to examine the factors associated with CPD, with particular reference to birthweight, stature, parity and maternal age. Design. Factors associated with CPD were analyzed using data abstracted from a detailed early hospital report from Ibadan, Nigeria and from a recent rural pregnancy study conducted in the Shire Valley, Malawi. Results. In Nigeria, of 107 CPD cases admitted to hospital in Ibadan during 1953-54, 79% were women > 20 years. Birthweight values increased significantly with age and parity. In 19.6% of cases, the baby had a low birthweight (< 2500 g). In Malawi, among the 1523 women delivering, the incidence of CPD was 2.3%. Of the 35 cases of CPD, only four were adolescents. Birthweights increased with increasing parity, age and height (p < 0.001). In 6.4% of CPD cases, the baby had a low birthweight. Nulliparity (OR 4.0; CI 1.7-9.3; p = 0.0001), birthweight ≥ 3400 g (OR 4.6; CI 2.1-10.0; p = 0.0001) and height ≤ 154 cm (OR 3.8; CI 1.8-7.9; p = 0.0003) were associated with an increased risk of CPD. Adolescent mothers were less likely to experience CPD (OR 0.3; C.I. 0.8-0.9; p = 0.03). Conclusions. Adolescents are not at high risk of CPD. Nutritional supplementation of girls and adolescents should not be discouraged for fear of increasing the risk of CPD by improving birthweight. When CPD is present, it may result from childhood rickets and calcium deficiency."
"Shah M.R.; Hasselblad V.; Stinnett S.S.; Kramer J.M.; Grossman S.; Gheorghiade M.; Adams Jr. K.F.; Swedberg K.; Califf R.M.; O'Connor C.M.","Shah, Monica R. (7402047401); Hasselblad, Vic (35408288100); Stinnett, Sandra S. (7004525827); Kramer, Judith M. (7402418043); Grossman, Steven (8844182500); Gheorghiade, Mihai (55382768600); Adams Jr., Kirkwood F. (7201820750); Swedberg, Karl (7102596603); Califf, Robert M. (36045760600); O'Connor, Christopher M. (35371777500)","7402047401; 35408288100; 7004525827; 7402418043; 8844182500; 55382768600; 7201820750; 7102596603; 36045760600; 35371777500","Dissociation between hemodynamic changes and symptom improvement in patients with advanced congestive heart failure","10.1016/S1388-9842(01)00202-1","https://www.scopus.com/inward/record.uri?eid=2-s2.0-0036623827&doi=10.1016%2fS1388-9842%2801%2900202-1&partnerID=40&md5=828b8d665dc3ea8378e27e9d2aba1dcb","Background: Changes in hemodynamic measures often serve as surrogate end points in efficacy trials for advanced heart failure, although there are few objective data to support this practice. Aims: We compared changes in hemodynamic variables vs. changes in symptoms of decompensated heart failure in patients enrolled in a randomized trial. Methods: We studied 201 patients with New York Heart Association (NYHA) class IIIb or IV heart failure and ejection fraction ≤25% for ≥3 months. Patients underwent continuous monitoring by pulmonary-artery catheter during inpatient drug administration. We assessed the relations of changes in hemodynamic variables (baseline minus final measure) to changes at 2 weeks in congestive heart failure symptoms, NYHA class, Yale Dyspnea-Fatigue Index (YDFI) score, and distance achieved in a 6-min walk. Results: No hemodynamic measure significantly predicted either symptom score or NYHA classification. Mean pulmonary artery pressure and pulmonary capillary wedge pressure did show some relation to change in YDFI score in univariable, but not multivariable, analysis. No hemodynamic measure correlated significantly with changes in distance achieved in the 6-min walk test. Conclusion: We noted no significant association between improved hemodynamics and improved symptoms in patients with advanced heart failure. Other measures may need to be evaluated as surrogate end points in future trials. © 2002 European Society of Cardiology. Published by Elsevier Science B.V. All rights reserved."
"Liu S.","Liu, Shuangzhe (55268389100)","55268389100","Local influence in multivariate elliptical linear regression models","10.1016/S0024-3795(01)00585-7","https://www.scopus.com/inward/record.uri?eid=2-s2.0-84971239675&doi=10.1016%2fS0024-3795%2801%2900585-7&partnerID=40&md5=658314c5ceb98281e850898235f70282","Local influence is a method of sensitivity analysis for assessing the influence of small perturbations in a general statistical model. In the present paper, this popular method is applied to multivariate elliptical linear regression models. Several schemes of perturbation, including perturbations in case-weights, explanatory variables and response variables are considered. The observed information matrix under the postulated model and Delta matrices under the corresponding perturbed models are derived. Assessment of local influence is made. © 2002 Elsevier Science Inc."
"Horská A.; Calhoun V.D.; Bradshaw D.H.; Barker P.B.","Horská, A. (7003602241); Calhoun, V.D. (7003595227); Bradshaw, D.H. (7101615278); Barker, P.B. (7402080565)","7003602241; 7003595227; 7101615278; 7402080565","Rapid method for correction of CSF partial volume in quantitative proton MR spectroscopic imaging","10.1002/mrm.10242","https://www.scopus.com/inward/record.uri?eid=2-s2.0-0036708140&doi=10.1002%2fmrm.10242&partnerID=40&md5=9efb0bea60a29e58f09299664a522634","Partial volume effects with cerebrospinal fluid (CSF), if uncorrected, can lead to underestimation of metabolite concentrations in quantitative proton magnetic resonance spectroscopic imaging (MRSI) of the brain. A rapid method for the correction of CSF partial volume effects is described based on selective CSF imaging using long echo time (TE) fast spin echo (FSE) magnetic resonance imaging (MRI). In order to achieve maximum suppression of signal from brain parenchyma, the FSE sequence is coupled with an inversion recovery (IR) pulse. Scan time is minimized using single shot (SS) IR-FSE. The method is validated against a current ""gold standard"" for the determination of CSF volumes, namely, segmented 3D spoiled gradient-echo (SPGR) scans. Excellent agreement in CSF percentage determined by the two methods was found (linear regression analysis: slope = 0.99 ± 0.02, intercept = 2.08 ± 0.45; mean ± standard errors, R = 0.93) in pooled data from four healthy subjects. An example of the use of SS-IR-FSE for partial volume correction in a leukodystrophy patient with T2 hyperintense lesions is demonstrated. SS-IR-FSE is a simple and rapid method for applying partial volume corrections in quantitative proton MRSI, which may be of particular value in the clinical environment when time constraints do not allow longer, perhaps more accurate segmentation methods to be used. © 2002 Wiley-Liss, Inc."
"Viazzi F.; Leoncini G.; Parodi D.; Ravera M.; Ratto E.; Vettoretti S.; Tomolillo C.; Del Sette M.; Bezante G.P.; Deferrari G.; Pontremoli R.","Viazzi, Francesca (6602920956); Leoncini, Giovanna (7006867458); Parodi, Denise (6602234714); Ravera, Maura (7004992030); Ratto, Elena (6602772254); Vettoretti, Simone (6603325556); Tomolillo, Cinzia (6603649337); Del Sette, Massimo (7003638145); Bezante, Gian Paolo (7004378769); Deferrari, Giacomo (7005156508); Pontremoli, Roberto (7004000993)","6602920956; 7006867458; 6602234714; 7004992030; 6602772254; 6603325556; 6603649337; 7003638145; 7004378769; 7005156508; 7004000993","Pulse pressure and subclinical cardiovascular damage in primary hypertension","10.1093/ndt/17.10.1779","https://www.scopus.com/inward/record.uri?eid=2-s2.0-0036797508&doi=10.1093%2fndt%2f17.10.1779&partnerID=40&md5=522219889345f343a6ac97d4d03be9f6","Background. High pulse pressure (PP) values have recently been implicated in the development and progression of large vessel atherosclerosis, small vessel disease, and in the occurrence of cardiovascular events. The aim of the present study is to investigate the relationship between PP and subclinical cardiovascular damage in a cohort of unselected middle-aged patients (204 male, 129 female) with untreated primary hypertension. Methods. PP was calculated as the difference between systolic (SBP) and diastolic blood pressure (DBP). Left ventricular mass index (LVMI) was assessed by M-B mode echocardiography (LVH = LVMI > 51 g/m2.7), and carotid intima-media thickness (IMT) by high-resolution US scan. Albuminuria was measured as the albumin to creatinine ratio (ACR) in three non-consecutive first morning urine samples. Results. PP was positively correlated to gender (P<0.05), duration of disease (P<0.001), age (P<0.0001), LDL cholesterol (P=0.007), and to early signs of target organ damage (TOD), namely LVMI (P<0.0001), IMT (P<0.0001), and ACR (P=0.036). Patients in the upper quartile of PP showed higher LVMI (P<0.001), thicker carotid walls (P<0.001), as well as higher ACR (P<0.04). Multiple linear regression analysis showed that PP and ACR independently influence LVMI (F= 26.476, r2 =0.29, P<0.0001) and IMT (F=17.813, r2 =0.26, P<0.0001). Patients with LVH, increased carotid IMT and microalbuminuria showed higher PP values as compared with those with lesser degrees of target organ involvement (F=4.97, P<0.003 inter-group comparison). Moreover, the risk of having the simultaneous occurrence of various signs of TOD increases significantly with each SD increase in PP or SBP, but is not influenced by DBP. Conclusions. PP is an independent marker of preclinical cardiovascular damage in relatively young patients with primary hypertension and, therefore, can be useful for identifying those at higher risk of cardiovascular events."
"Kurpad A.V.; Raj T.; Regan M.M.; Vasudevan J.; Caszo B.; Nazareth D.; Gnanou J.; Young V.R.","Kurpad, Anura V. (7004363127); Raj, Tony (8064084900); Regan, Meredith M. (7103031293); Vasudevan, Jahnavi (6602737625); Caszo, Brinnell (8084406000); Nazareth, Dilip (6701336023); Gnanou, Justin (6602850840); Young, Vernon R. (57201223959)","7004363127; 8064084900; 7103031293; 6602737625; 8084406000; 6701336023; 6602850840; 57201223959","Threonine requirements of healthy Indian men, measured by a 24-h indicator amino acid oxidation and balance technique","10.1093/ajcn/76.4.789","https://www.scopus.com/inward/record.uri?eid=2-s2.0-0036783742&doi=10.1093%2fajcn%2f76.4.789&partnerID=40&md5=4a5bcf1a4abf367ff2fd4c159803b038","Background: We previously questioned the validity of the 1985 FAO/WHO/UNU upper requirement value for threonine (7 mg·kg-1·d-1) and proposed a tentative mean requirement of 15 mg·kg-1d-1. Objective: In this study we used a 24-h indicator amino acid oxidation and balance technique, with [1-13C]leucine as the indicator amino acid, to assess threonine adequacy at 6 test intakes (7, 11, 15, 19, 22, and 27 mg·kg-1·d-1) with a 6-d dietary adaptation phase in healthy, well-nourished Indian men. Design: Sixteen men were randomly allocated to 3 of 6 test intakes and were studied after 6 d of adaptation to the experimental diets. Diets were based on an L-amino acid mixture in which the threonine content was varied. At 1800 on day 6, a 24-h intravenous [13C]leucine tracer infusion protocol was conducted to assess 24-h leucine oxidation and daily leucine balances. Results: Leucine balances differed significantly (P = 0.02) between the different intakes of threonine. Two-phase linear regression analysis from 12-h and 24-h leucine oxidation and 24-h leucine balance gave a breakpoint at a threonine intake of 15 mg·kg-1·d-1, with 95% CIs ranging from 11 to 27 mg·kg-1·d-1. There was no significant effect of threonine intake on 24-h leucine flux. Conclusion: The results of the 24-h indicator amino acid oxidation and balance experiments indicate that the current FAO/WHO/UNU threonine recommendation of 7 mg·kg-1·d-1 is inadequate. A mean threonine intake of 15 mg·kg-1·d-1 is sufficient to achieve the indicator (leucine) amino acid balance in healthy Indian men."
"Platt C.M.R.; Young S.A.; Austin R.T.; Patterson G.R.; Mitchell D.L.; Miller S.D.","Platt, C.M.R. (7006575453); Young, S.A. (7404514776); Austin, R.T. (7202857052); Patterson, G.R. (57197655089); Mitchell, D.L. (23065650200); Miller, S.D. (55476786400)","7006575453; 7404514776; 7202857052; 57197655089; 23065650200; 55476786400","LIRAD observations of tropical cirrus clouds in MCTEX. Part I: Optical properties and detection of small particles in cold cirrus","10.1175/1520-0469(2002)059<3145:LOOTCC>2.0.CO;2","https://www.scopus.com/inward/record.uri?eid=2-s2.0-0346319019&doi=10.1175%2f1520-0469%282002%29059%3c3145%3aLOOTCC%3e2.0.CO%3b2&partnerID=40&md5=31b226945d587eec7208032b09e7d320","This paper presents further results on the optical properties of tropical and equatorial cirrus using the light detecting and ranging (lidar) radiometer (LIRAD) method. The results were obtained from observations in the Maritime Continent Thunderstorm Experiment (MCTEX). Values were obtained of cirrus cloud backscatter coefficient, infrared (IR) emittance, optical depth and absorption coefficient, cloud height and depth, and back-scatter-to-extinction ratio. The values agree well with previous results obtained on equatorial cirrus in the Pilot Radiation Observation Experiment (PROBE) and extend those results to lower temperatures. Observations made of lidar linear depolarization ratio show similar trends to those observed in PROBE, extending those results to lower temperatures. Regressions of cloud IR emittance and absorption coefficients are performed as a preliminary tropical dataset for both cloud-resolving and climate models. These regressions are compared with previous regressions on midlatitude and tropical synoptic cirrus clouds. The IR absorption coefficients in tropical and equatorial cirrus appear to be larger than in midlatitude cirrus for temperatures less than -40°C, with the difference increasing toward low temperatures. Thus, a significantly different relationship may be appropriate for tropical cirrus compared to midlatitude cirrus clouds. Effective diameters of small particles in the colder tropical clouds are also measured using the ratio of visible extinction to infrared absorption. A new treatment of multiple scattering is used to correct the ratios. Effective diameters range from 6 to 9.3 μm at the colder temperatures."
"Vollmer R.T.; Egawa S.; Kuwao S.; Baba S.","Vollmer, Robin T. (35300694700); Egawa, Shin (34769786700); Kuwao, Sadahito (26643533000); Baba, Shiro (57213890819)","35300694700; 34769786700; 26643533000; 57213890819","The dynamics of prostate specific antigen during watchful waiting of prostate carcinoma: A study of 94 Japanese men","10.1002/cncr.10443","https://www.scopus.com/inward/record.uri?eid=2-s2.0-0037086468&doi=10.1002%2fcncr.10443&partnerID=40&md5=e4cd91c1aa104bec99ed4e1bc4f2dc4b","BACKGROUND. For the moment, there is uncertainty about the usefulness of early treatment of localized prostate carcinoma, uncertainty about whether some patients with early cancer can be managed expectantly, and uncertainty about how such patients might be recognized. METHODS. The authors studied serial values of prostate specific antigen (PSA) in 94 Japanese men with diagnosed prostate carcinoma and who were managed by watchful waiting. Their median follow-up duration was 32 months (range, 1.6-118). The authors used a log-linear model to fit the values of PSA over time, and then they used the Cox survival model to relate the intercept (PSA amplitude) and slope (relative velocity) to observed local or systemic outcomes that were independent of PSA. RESULTS. The authors found that the log-linear model fit the serial values of PSA during watchful waiting very well. Prostate specific antigen amplitude related significantly to T classification (P = 0.0006), but not to grade (P > 0.2), and the relative velocity related significantly to both T classification (P = 0.009) and to grade (P = 0.02). Although the T classification, histologic grade, and log(PSA) at diagnosis were associated significantly with time to outcome, the combination of amplitude and relative velocity provided more information. These 2 PSA parameters resulted in a higher model likelihood ratio, and their individual P values in the Cox model were 0.0005 and 0.005, respectively. With these two in the Cox model, T classification, grade, log(PSA), and PSA doubling time provided no further significant information. CONCLUSIONS. A log-linear model seems to fit serial measurements of PSA during watchful waiting, and preliminary results suggest that both the amplitude and the relative velocity relate closely to clinical outcomes. © 2002 American Cancer Society."
"Santoro C.; Cosmas A.; Forman D.; Morghan A.; Bairos L.; Levesque S.; Roubenoff R.; Hennessey J.; Lamont L.; Manfredi T.","Santoro, Cheryl (7004920901); Cosmas, Arthur (6508289229); Forman, Danial (7101730048); Morghan, Alia (6504093373); Bairos, Lynn (6507863453); Levesque, Sebrina (7003676540); Roubenoff, Ronenn (7004810432); Hennessey, James (7006761871); Lamont, Linda (7005778901); Manfredi, Thomas (6602112542)","7004920901; 6508289229; 7101730048; 6504093373; 6507863453; 7003676540; 7004810432; 7006761871; 7005778901; 6602112542","Exercise training alters skeletal muscle mitochondrial morphometry in heart failure patients","10.1177/174182670200900612","https://www.scopus.com/inward/record.uri?eid=2-s2.0-0036932266&doi=10.1177%2f174182670200900612&partnerID=40&md5=ac29e0023ef5766653b84a0fee06afd4","Background Previous research has demonstrated that exercise intolerance in heart failure patients is associated with significant alterations in skeletal muscle ultrastructure and oxidative metabolism that may be more consequential than cardiac output. Design To examine the effect of exercise training on skeletal muscle mitochondrial size in chronic heart failure patients. Methods Six heart failure patients participated in 16-weeks of supervised upper and lower extremity exercise training. At the conclusion of training, percutaneous needle biopsies of the vastus lateralis were taken and electron microscopy was used to assess mitochondrial sizes. Results The exercise programme resulted in a significant increase in peak maximal oxygen consumption (P < 0.05) and anaerobic threshold (P < 0.04). Knee extension muscle force increased following training (P < 0.02). After exercise training, the average size of the mitochondria increased by 23.4% (0.036 to 0.046 m2P < 0.015) and the average shape was unaltered. Conclusion Exercise training with heart failure patients alters skeletal muscle morphology by increasing mitochondrial size, with no change in shape. This may enhance oxidative metabolism resulting in an increased exercise tolerance. © 2002, European Society of Cardiology. All rights reserved."
"Gutdeutsch R.; Kaiser D.; Jentzsch G.","Gutdeutsch, Rolf (16491093900); Kaiser, Diethelm (7202543360); Jentzsch, Gerhard (7003389290)","16491093900; 7202543360; 7003389290","Estimation of earthquake magnitudes from epicentral intensities and other focal parameters in Central and Southern Europe","10.1046/j.1365-246X.2002.01804.x","https://www.scopus.com/inward/record.uri?eid=2-s2.0-0036899822&doi=10.1046%2fj.1365-246X.2002.01804.x&partnerID=40&md5=ad5c81afa69b85e417abed8a71a49bd3","The publication of an earthquake catalogue by Kárnik in 1996 (a continuation and revision of an earlier one (1969) makes important data available covering one century of the seismic history of Central and Southern Europe. It allows us to study in detail empirical relations between the magnitude and other focal parameters. In this study well-known relations combining two or three focal parameters, M = A + BIo + C log(H), Ms = D + EI0 + F log(H), ML = G + OI0 + P log(H), ML = Q + RMs + S log(H), are investigated (M, Kárnik's magnitude; ML, local magnitude; Ms, surface wave magnitude; I0, epicentral intensity; H, focal depth in kilometers). The data show a considerable scatter with respect to the relations above. The relations are considered useful, if the following significance criteria are fulfilled. (1) The data sets comprise a minimum of 20 entries. (2) The partial correlation between the two most important parameters is greater than 70 per cent. (3) The parameter of least importance still influences the correlation of the others by more than 5 per cent. The partial correlation coefficients help to decide whether the data are to be rejected as insufficient for the regression analysis or to determine the level beyond which it is useful to perform a regression analysis excluding the parameter of lowest importance. Two kinds of regression are carried out: (1) standard linear regression assumes that only M or ML, respectively, are in error, while the remaining two parameters are error-free. (2) Orthogonal regression assumes that all three parameters have errors. This is the case for the data in the catalogue used here. The orthogonal regression M = -1.682 + 0.654I0 + 1.868 log(H), with a standard deviation of ±0.284, differs considerably from Kárnik's empirical relation M = 0.5I0 + log(H) + 0.35 for shallow foci, but agrees well with the results of earlier studies by the authors for earthquakes in SE Europe. The data set M, I0, H (for H < 50 km) fails criterion (3). The orthogonal least-squares fit without log(H) has been found as follows: Ms = 0.550I0 + 1.260, with a standard deviation of ±0.412. We observe systematic regional deviations from this relationship, which need further investigation. The correlation analysis shows that ML and Ms are weakly linked with log(H), but the correlation between ML and Ms is very high (93 per cent). Therefore, the orthogonal relation between ML and Ms without the log(H) term was chosen: ML = 0.664 + 0.893 Ms, with a standard deviation of ±0.163. The correlations between ML, I0 and log(H) do not fulfil the significance criteria. For the purpose of earthquake hazard analysis the orthogonal regression visualizes simultaneously the errors of all input data, i.e. δMLi, δMi and δ log(Hi). Our new relationships result from orthogonal regression analysis using a large high-quality data set. They should be applicable in Central and Southern Europe unless there are regional relationships available that fit the data better."
"Hagberg G.E.; Indovina I.; Sanes J.N.; Posse S.","Hagberg, G.E. (7005745816); Indovina, I. (7004201459); Sanes, J.N. (7101618553); Posse, S. (7003957150)","7005745816; 7004201459; 7101618553; 7003957150","Real-time quantification of T*2 changes using multiecho planar imaging and numerical methods","10.1002/mrm.10283","https://www.scopus.com/inward/record.uri?eid=2-s2.0-0036846412&doi=10.1002%2fmrm.10283&partnerID=40&md5=de30f50bef282d5fb03fc57bd59f5990","Conventional approaches to quantify whole brain T*2 maps use nonlinear regression with intensive computational requirements that therefore likely limit quantitative T*2 mapping for real-time applications. To overcome these limitations an alternative method, NumART*2 (NUMerical Algorithm for Real-time T*2 mapping) that directly calculates T*2 by a linear combination of images obtained at three or more different echo times was developed. NumART*2, linear least-squares, and nonlinear regression techniques were applied to multiecho planar images of the human brain and to simulated data. Although NumART*2 may overestimate T*2, it yields comparable values to regression techniques in cortical and subcortical areas, with only moderate deviations for echo spacings between 18 and 40 ms. NumART*2, like linear regression, requires 2% of the computational time needed for nonlinear regression and compares favorably with linear regression due to its higher precision. The use of NumART*2 for continuous on-line T*2 mapping in real time fMRI studies is shown. © 2002 Wiley-Liss, Inc."
