"Authors","Author full names","Author(s) ID","Title","DOI","Link","Abstract"
"Chiu T.-C.; Huang M.-F.; Huang C.-C.; Hsieh M.-M.; Chang H.-T.","Chiu, Tai-Chia (7202210253); Huang, Ming-Feng (7404260655); Huang, Chih-Ching (57892924300); Hsieh, Ming-Mu (7202490135); Chang, Huan-Tsung (7407521789)","7202210253; 7404260655; 57892924300; 7202490135; 7407521789","Indirect fluorescence of aliphatic carboxylic acids in nonaqueous capillary electrophoresis using merocyanine 540","10.1002/1522-2683(200202)23:3<449::AID-ELPS449>3.0.CO;2-P","https://www.scopus.com/inward/record.uri?eid=2-s2.0-0036196211&doi=10.1002%2f1522-2683%28200202%2923%3a3%3c449%3a%3aAID-ELPS449%3e3.0.CO%3b2-P&partnerID=40&md5=171d93ddaf261375869a8d8477f8eab6","A method for the analysis of aliphatic carboxylic acids (ACAs) in nonaqueous capillary electrophoresis (NACE) in conjunction with indirect laser-induced fluorescence (ILIF) using merocyanine 540 (MC 540) is described. Performing the analysis in organic solvent is advantageous when using MC 540, because of its greater quantum yield in aprotic solvent. To achieve a high dynamic reserve (DR) and optimize resolution, we have tested a number of aqueous mixtures containing alcohols and acetonitrile (ACN). The optimum buffer for the analysis of C2-C18 ACAs, in terms of sensitivity, resolution, and speed, is an aqueous mixture of 40% ACN, 30% ethanol, and 1 mM Tris at apparent pH 7.4 (adjusted with ascorbic acid). Under this condition, the DR is greater than 1000, thereby the limits of detection for acids are in the range of sub-μM to μM. Linear plots show that the dynamic ranges for the analysis of ACAs are at least two decades in concentration, with regression coefficients all greater than 0.98. The relative standard deviations of the migration times and peak heights for all ACAs are less than 2.0%. Furthermore, this simple and cost-effective method has been applied to the analysis of marine lipid concentrate, with the concentrations of 1.67 ± 0.03 and 4.50 ± 0.05 mM (n = 5) for C14 and C16 acids, respectively, in a tablet of marine lipid concentrate sample."
"Achberger C.; Ekström M.; Bärring L.","Achberger, C. (6602962994); Ekström, M. (7004412956); Bärring, L. (6603581022)","6602962994; 7004412956; 6603581022","Estimation of local near-surface wind conditions - A comparison of WASP and regression based techniques","10.1017/S1350482702002062","https://www.scopus.com/inward/record.uri?eid=2-s2.0-0042194464&doi=10.1017%2fS1350482702002062&partnerID=40&md5=ea574f78b719b7545b9a658914129c58","This study compares the performance of different models used to assess the local wind near-surface conditions at an agricultural site in Scania, southern Sweden. The methods are: (a) the WASP model (Wind Analysis and Application Program), (b) separate linear regressions of the two wind vector components, (c) a regression model based on vector correlation, and (d) linear regression of scalar wind. Each method was tested with three different data sets over nine months: wind measurements from the nearby Sturup airport SYNOP station, 10 m surface wind and surface geostrophic wind produced by the operational Swedish Mesoscale Analysis system (Mesan). The wind climate estimations were compared with observed winds at the field site, with respect to mean wind speed, wind direction, wind speed frequency distribution and the relative frequency of winds above 6 m s-1. All models performed reasonably well with data from Sturup and Mesan surface wind, but gave less reliable results with the Mesan geostrophic data. The estimated frequency of winds above 6 m s-1 was in general lower than the observed frequency. Overall, best results were obtained with WASP in combination with measurements from Sturup."
"Takeuchi I.; Bengio Y.; Kanamori T.","Takeuchi, Ichiro (35312449700); Bengio, Yoshua (7003958245); Kanamori, Takafumi (7102314916)","35312449700; 7003958245; 7102314916","Robust regression with asymmetric heavy-tail noise distributions","10.1162/08997660260293300","https://www.scopus.com/inward/record.uri?eid=2-s2.0-0036781791&doi=10.1162%2f08997660260293300&partnerID=40&md5=edd3e7ee524c88f6b934e4246f586bfd","In the presence of a heavy-tail noise distribution, regression becomes much more difficult. Traditional robust regression methods assume that the noise distribution is symmetric, and they downweight the influence of so-called outliers. When the noise distribution is asymmetric, these methods yield biased regression estimators. Motivated by data-mining problems for the insurance industry, we propose a new approach to robust regression tailored to deal with asymmetric noise distribution. The main idea is to learn most of the parameters of the model using conditional quantile estimators (which are biased but robust estimators of the regression) and to learn a few remaining parameters to combine and correct these estimators, to minimize the average squared error in an unbiased way. Theoretical analysis and experiments show the clear advantages of the approach. Results are on artificial data as well as insurance data, using both linear and neural network predictors."
"Kawamoto R.; Kohara K.; Tabara Y.; Miki T.","Kawamoto, Ryuichi (55368872600); Kohara, Katsuhiko (26643367500); Tabara, Yasuharu (6602828644); Miki, Tetsuro (35377768000)","55368872600; 26643367500; 6602828644; 35377768000","An interaction between systolic blood pressure and angiotensin-converting enzyme gene polymorphism on carotid atherosclerosis","10.1291/hypres.25.875","https://www.scopus.com/inward/record.uri?eid=2-s2.0-0036866329&doi=10.1291%2fhypres.25.875&partnerID=40&md5=c5fbb89e913c2d70b1fa9b728385b3f7","The insertion/deletion (I/D) polymorphism of the human angiotensin-converting enzyme (ACE) gene is a major determinant of circulating ACE activity, with the D allele being associated with higher ACE levels than the I allele. Thus, chronic exposure to high levels of circulating and tissue ACE may well predispose to vascular wall thickening and atherosclerosis. However, the effect of the ACE gene on carotid atherosclerosis remains controversial. We investigated the association between ACE gene I/D polymorphism and risk factor-dependent augmentation of carotid arterial remodeling in subjects with several risk factors for atherosclerosis. We evaluated sclerotic lesions of the common carotid artery with intima-media thickness (IMT) by ultrasonography in 184 patients (mean age±SD, 67±14 years old) and studied whether any risk factor-gene interactions were associated with carotid atherosclerosis. Out of the 184 subjects, 71 had the ACE II genotype, 87 the ID genotype and 26 the DD genotype. There was no significant difference in IMT among the three ACE genotypes. In total subjects, multiple regression analysis showed that age, total-cholesterol (T-C), and HDL-cholesterol (HDL-C) were significantly associated with IMT. However, the association between risk factors and IMT was genotype-specific. Systolic blood pressure (SBP) and HDL-C were significantly associated with IMT in ACE D carriers (DD+ID), but not in subjects with the ACE II genotype. Similarly, T-C was significantly associated with IMT only in subjects with the ACE II genotype. A general linear model of the interaction between the ACE genotype and the conventional risk factors showed that the SBP-ACE genotype interaction were significantly associated with IMT (F=7.915; p=0.005). This finding further supports the idea that analysis of risk factor-gene interaction could be a useful tool for deriving specific predictive information about the development of atherosclerosis."
"Morishima I.; Sone T.; Tsuboi H.; Kondo J.; Mukawa H.; Kamiya H.; Hieda N.; Okumura K.","Morishima, Itsuro (7101819139); Sone, Takahito (7103284525); Tsuboi, Hideyuki (36004457200); Kondo, Junichiro (7201382977); Mukawa, Hiroaki (6603595950); Kamiya, Hiroki (57197858280); Hieda, Nobuyuki (57207713110); Okumura, Kenji (56585278500)","7101819139; 7103284525; 36004457200; 7201382977; 6603595950; 57197858280; 57207713110; 56585278500","Plasma C-reactive protein predicts left ventricular remodeling and function after a first acute anterior wall myocardial infarction treated with coronary angioplasty: Comparison with brain natriuretic peptide","10.1002/clc.4960250306","https://www.scopus.com/inward/record.uri?eid=2-s2.0-0036189366&doi=10.1002%2fclc.4960250306&partnerID=40&md5=e5fc2e2ad605fc82dda37c706bf829fc","Background: C-reactive protein (CRP) directly participates in the myocardial injury of acute myocardial infarction (MI). Although high plasma CRP levels in the acute phase strongly indicate a poor early clinical outcome of patients with MI, the impact of CRP levels on late left ventricular (LV) function and remodeling, which are closely associated with long-term prognosis, remains unknown. Hypothesis: Acute plasma CRP levels may predict late LV function and remodeling after MI. Methods: We prospectively studied 12 consecutive patients with a first acute anterior MI recanalized by angioplasty. We measured plasma CRP levels on Days 0, 1, 2, 3, 4, and 7, and calculated the area under the curve (AUC). We also measured plasma brain natriuretic peptide (BNP) levels on Day 3 as the referential indicator of LV dysfunction and late LV remodeling. Late LV indices were independently assessed on a left ventriculogram obtained at 5.3 months to estimate the extent of LV remodeling. Results: Plasma CRP reached its peak at Day 2.8 (8.68 ± 4.57 mg/dl). On linear regression analysis, the AUC of CRP (35.21 ± 19.33 mg/dl × day) correlated positively with BNP (316.5 ± 418.6 pg/ml) (r = 0.646, p = 0.023). The AUC of CRP, peak CRP, and BNP correlated significantly with late LV indices, Among these, the AUC of CRP showed the best correlation with end-diastolic volume index (r = 0.765, p = 0.004), end-systolic volume index (r = 0.907, p<0.001), and ejection fraction (r = - 0.862, p<0.001). Conclusions: Patients with high plasma CRP levels may be at risk for late LV dysfunction and remodeling; theoretically, their long-term prognosis may be poor. Measuring plasma CRP levels may provide valuable information for long-term risk stratification after MI."
"Florindo A.A.; Latorre M.D.R.D.O.; Jaime P.C.; Tanaka T.; Pippa M.G.B.; Zerbini C.A.F.","Florindo, Alex A. (6602907958); Latorre, Maria Do Rosario D. O. (35447169500); Jaime, Patricia C. (6602439549); Tanaka, Tomoe (56164744400); Pippa, Maria G. B. (6507547143); Zerbini, Cristiano A. F. (35552328000)","6602907958; 35447169500; 6602439549; 56164744400; 6507547143; 35552328000","Past and present habitual physical activity and its relationship with bone mineral density in men aged 50 years and older in Brazil","10.1093/gerona/57.10.M654","https://www.scopus.com/inward/record.uri?eid=2-s2.0-0036786179&doi=10.1093%2fgerona%2f57.10.M654&partnerID=40&md5=b6ca0954f5b1f198de7879c2c5cbd8c7","Background. The aim of this study was to determine the relationship between habitual physical activity (HPA) during life and bone mineral density (BMD) in men aged 50 years and older. Methods. A total of 326 men aged 50 years and older, volunteers living in Saão Paulo city, Brazil, were studied. BMD was measured in the whole body, femoral neck, Ward's triangle, trochanter, and lumbar spine (L2-L4) with a dual-energy x-ray absorptiometer. The HPA data were collected with questionnaires inquiring about physical exercise and occupational physical activity in the past and during the past 12 months and leisure and locomotor physical activity in the preceding 12 months. The relationship between BMD and HPA was analyzed using multiple linear regression models adjusted for age and body mass index (BMI). Results. Practice of physical exercise in the past 10-20 years and leisure and locomotor physical activity in the preceding 12 months showed a significant positive correlation with BMD of whole body, femoral neck, trochanter, and lumbar spine, and this association was independent of age and BMI. Conclusions. HPA can contribute to preserving BMD in men aged 50 years and older in Brazil, when it is practiced in the past 10-20 years and even in the present. © Oxford University Press 2002."
"Marchini G.; Babighian S.; Specchia L.; Perfetti S.","Marchini, Giorgio (7005720033); Babighian, Silvia (6602493502); Specchia, Luca (18937280800); Perfetti, Sergio (6601993138)","7005720033; 6602493502; 18937280800; 6601993138","Evaluation of the new Ocuton S tonometer","10.1034/j.1600-0420.2002.800209.x","https://www.scopus.com/inward/record.uri?eid=2-s2.0-0036121319&doi=10.1034%2fj.1600-0420.2002.800209.x&partnerID=40&md5=1113f371ee015a4aab0106f547631ac5","Purpose: To evaluate the intra- and interobserver variability of the Ocuton S tonometer, its correlation with Goldmann tonometry, the reliability of self-tonometry and the safety of the instrument. Methods: Thirty-five healthy subjects and 45 patients with primary open-angle glaucoma (POAG), aged from 38 to 80 years (mean age: 64.6 ± 12.2 years), underwent tonometry with the Ocuton S tonometer in one eye chosen at random. The intra- and interobserver variability between two operators (kappa coefficient), the Ocuton S/Goldmann correlation and the reliability of self-tonometry were evaluated by performing two tonometries on each patient in subgroups. Each tonometry was considered as the mean of three consecutive measurements. Central ultrasonic pachymetry, keratometry and corneal biomicroscopy were also evaluated. Results: The intra- and interobserver variability ranged from 0.38 to 0.66. The difference between the means of intraocular pressure (IOP) with the Ocuton S (24.4 ± 4.7 mmHg) and the Goldmann tonometer (18.1 ± 4.7 mmHg) was statistically significant (p < 0.0001). Linear regression analysis revealed a good Ocuton S/Goldmann correspondence (r = 0.88, p = 0.0001). However, IOP values detected with the Ocuton were consistently overestimated, compared to those detected with the Goldmann tonometer. The correlation between corneal thickness and IOP was statistically significant both for the Goldmann (r = 0.510, p = 0.021) and for the Ocuton S tonometer (r = 0.520, p = 0.019). No correlation was found between keratometry and IOP. The mean measurement obtained by self-tonometry (21.9 ± 3.6 mmHg) showed no statistically significant difference when compared to the mean measurement obtained by an expert operator (21.3 ± 3.4 mmHg). Conclusion: The Ocuton S tonometer is a safe instrument that can be used easily by the patient. However, in comparison to the Goldmann tonometer, it overestimates IOP and requires further technical and methodological refinements in order to ensure greater reliability."
"Arnold B.F.; Stahlecker P.","Arnold, Bernhard F. (7102305694); Stahlecker, Peter (55976038700)","7102305694; 55976038700","Linear regression analysis using the relative squared error","10.1016/S0024-3795(01)00572-9","https://www.scopus.com/inward/record.uri?eid=2-s2.0-31244436349&doi=10.1016%2fS0024-3795%2801%2900572-9&partnerID=40&md5=0a4a0028ee619bcff2b346fc9c052dae","In order to determine estimators and predictors in a generalized linear regression model we apply a suitably defined relative squared error instead of the most frequently used absolute squared error. The general solution of a matrix problem is derived leading to minimax estimators and predictors. Furthermore, we consider an important special case, where an analogon to a well-known relation between estimators and predictors holds and where generalized least squares estimators as well as Kuks–Olman and ridge estimators play a prominent role. © 2001 Elsevier Science Inc."
"Varodompun N.; Thinley T.; Visutipol B.; Ketmalasiri B.; Pattarabunjerd N.","Varodompun, Namchai (6506407219); Thinley, Tshewang (6504377643); Visutipol, Boonyarak (6507612328); Ketmalasiri, Bunyat (6505925911); Pattarabunjerd, Narongchai (6503912255)","6506407219; 6504377643; 6507612328; 6505925911; 6503912255","Correlation between the acetabular diameter and thickness in Thais","10.1177/230949900201000108","https://www.scopus.com/inward/record.uri?eid=2-s2.0-0036625056&doi=10.1177%2f230949900201000108&partnerID=40&md5=1c1f59f628bb32515bbf110ced672ca4","We conducted a study on dried cadaveric pelvic bones to determine the relation between acetabular diameter and thickness of the acetabular wall. The acetabulum was divided into four quadrants: antero-superior, postero-superior, postero-inferior, and antero-inferior. The diameters of the acetabulum were measured for 152 pelvic bones. The thickness of the center of the acetabulum was measured with the use of a caliper at four quadrants of the acetabulum. The average acetabular diameter was found to be 51.8224 mm for all the acetabuli. The average thickness in the posterior quadrant has been calculated to be about 50% of the acetabular diameter, which is about 26 mm. The acetabular diameter and the thickness of the acetabulum correlated very well though there was very little significance statistically (0.099) due to the lack of full data for all the individual bones. Linear correlation between the thickness and the diameter is definitely collinear but the correlation is not statistically significant. Some additional factors such as bone density, body mass, etc, are required to correlate the thickness and the diameter. Further study is required in this field."
"Dai F.; Gong J.; Zhang R.; Luo J.-Y.; Zhu Y.-L.; Wang X.-Q.","Dai, Fei (57206263474); Gong, Jun (7402707712); Zhang, Ru (57744281000); Luo, Jin-Yan (26643624400); Zhu, You-Ling (8623300600); Wang, Xue-Qin (56005677200)","57206263474; 7402707712; 57744281000; 26643624400; 8623300600; 56005677200","Assessment of duodenogastric reflux by combined continuous intragastric pH and bilirubin monitoring","10.3748/wjg.v8.i2.382","https://www.scopus.com/inward/record.uri?eid=2-s2.0-0036235591&doi=10.3748%2fwjg.v8.i2.382&partnerID=40&md5=032c0e3c6a83f5566888040b22c25eab","Aim: To assess the diagnostic value of a combination of continuous intragastric pH and bilirubin monitoring in the detection of duodenogastric reflux (DGR), and the effects of diet on the bilirubin absorbance. Methods: 30 healthy volunteers were divided into two groups: standard diet group (Group 1) 18 cases, free diet group (Group 2) 12 cases. Each subjects were subjected to simultaneous 24 hour intragastric pH and spectrophotometric bilirubin concentration monitoring (Bilitec 2000). Results: There was no difference of preprandial phase bilirubin absorbance between two groups. The absorbance of postprandial phase was significantly increased in group 2 than group 1. There was no difference between preprandial phase and postprandial phase absorbance in group 1. Postprandial phase absorbance was significantly higher in group 2. In a comparison of bile reflux with intragastric pH during night time, there were 4 types of reflux: Simultaneous increase in absorbance and pH in only 19.6%, increase in bilirubin with unchanged pH 33.3%, pH increase with unchanged absorbance 36.3%, and both unchanged in 10.8%. Linear regression analysis showed no correlation between percentage total time of pH < 4 and percentage total time of absorbance > 0.14, r = 0.068, P < 0.05. Conclusion: Because of the dietary effect, high absorbance fluids or foods should be avoided in detection. Intragastric pH and bilirubin monitoring separately predict the presence of duodenal (and/or pancreatic) reflux and bile reflux. They can not substitute for each other. The detection of DGR is improved if the two parameters are combined simultaneously."
"Stetzer B.P.; Thomas A.; Amini S.B.; Catalano P.M.","Stetzer, Bradley P. (6507551095); Thomas, Alicia (7403883446); Amini, Saeid B. (56943806600); Catalano, Patrick M. (7101947503)","6507551095; 7403883446; 56943806600; 7101947503","Neonatal anthropometric measurements to predict birth weight by ultrasound","10.1038/sj.jp.7210754","https://www.scopus.com/inward/record.uri?eid=2-s2.0-0036342171&doi=10.1038%2fsj.jp.7210754&partnerID=40&md5=06c213a4d7a86ea21c5f4dd2187628df","Objective: To develop a more accurate ultrasound birth weight (BW) model using neonatal anthropometric measurements. Study Design: Two hundred thirty-one newborns were evaluated. Measurements included weight; head, chest, and abdominal circumferences (umbilicus and liver), humerus, and femur lengths. Infants were randomly assigned into two groups (G1 and G2). Anthropometric measurements that are obtainable by ultrasound were generated from G1. Stepwise regression and a bootstrap analysis were used to create the prediction models. The models were validated using G2. Results: The final stepwise regression model included FL and circumferences of the head, chest, and abdomen. The correlations were: G1: R2=0.91, p<0.001; G2: R2=0.90 p < 0.001. There was no difference between derived and actual BW in G1 (p=0.42) or G2 (p=0.28). The mean absolute percent error between the prediction model and actual BW was 3.8%. Conclusion: Neonatal anthropometric models are strongly predictive of actual BW. This model will be tested prospectively using ultrasound to predict fetal weight."
"Smolle J.; Gerger A.; Weger W.; Kutzner H.; Tronnier M.","Smolle, Josef (7102862070); Gerger, Armin (6603413077); Weger, Wolfgang (6602286145); Kutzner, Heinz (55159861000); Tronnier, Michael (7006902746)","7102862070; 6603413077; 6602286145; 55159861000; 7006902746","Tissue counter analysis of histologic sections of melanoma: Influence of mask size and shape, feature selection, statistical methods and tissue preparation","10.1155/2002/141295","https://www.scopus.com/inward/record.uri?eid=2-s2.0-0036428540&doi=10.1155%2f2002%2f141295&partnerID=40&md5=213870e91f004e7e143c8cc2845989b5","Background: Tissue counter analysis is an image analysis tool designed for the detection of structures in complex images at the macroscopic or microscopic scale. As a basic principle, small square or circular measuring masks are randomly placed across the image and image analysis parameters are obtained for each mask. Based on learning sets, statistical classification procedures are generated which facilitate an automated classification of new data sets. Objective: To evaluate the influence of the size and shape of the measuring masks as well as the importance of feature selection, statistical procedures and technical preparation of slides on the performance of tissue counter analysis in microscopic images. As main quality measure of the final classification procedure, the percentage of elements that were correctly classified was used. Study design: H&E-stained slides of 25 primary cutaneous melanomas were evaluated by tissue counter analysis for the recognition of melanoma elements (section area occupied by tumour cells) in contrast to other tissue elements and background elements. Circular and square measuring masks, various subsets of image analysis features and classification and regression trees compared with linear discriminant analysis as statistical alternatives were used. The percentage of elements that were correctly classified by the various classification procedures was assessed. In order to evaluate the applicability to slides obtained from different laboratories, the best procedure was automatically applied in a test set of another 50 cases of primary melanoma derived from the same laboratory as the learning set and two test sets of 20 cases each derived from two different laboratories, and the measurements of melanoma area in these cases were compared with conventional assessment of vertical tumour thickness. Results: Square measuring masks were slightly superior to circular masks, and larger masks (64 or 128 pixels in diameter) were superior to smaller masks (8 to 32 pixels in diameter). As far as the subsets of image analysis features were concerned, colour features were superior to densitometric and Haralick texture features. Statistical moments of the grey level distribution were of least significance. CART (classification and regression tree) analysis turned out to be superior to linear discriminant analysis. In the best setting, 95% of melanoma tissue elements were correctly recognized. Automated measurement of melanoma area in the independent test sets yielded a correlation of r = 0.846 with vertical tumour thickness (p < 0.001), similar to the relationship reported for manual measurements. The test sets obtained from different laboratories yielded comparable results. Conclusions: Large, square measuring masks, colour features and CART analysis provide a useful setting for the automated measurement of melanoma tissue in tissue counter analysis, which can also be used for slides derived from different laboratories."
